{
  "schema_version": "genesis.draft.manifest.v0.1",
  "protocol_version": "genesis.protocol.v0.1",
  "root_hash_profile": "genesis.hash.fields.v0.1",
  "file_digest_algorithm": "sha256",
  "inventory_path": "conformance/required_artifacts.json",
  "manifest_path": "conformance/draft_manifest.json",
  "self_excluded": true,
  "file_count": 193,
  "files": [
    {
      "path": ".github/workflows/conformance.yml",
      "size_bytes": 948,
      "digest": "sha256:d3e43662cbf25f7447458ac5e9cebb35898f6d55db468e43fd9f7bf7d594fd92"
    },
    {
      "path": ".gitignore",
      "size_bytes": 164,
      "digest": "sha256:241be612bb8b478708e58355b3d12078ff22f8a62940acdc800c37286a1f36b7"
    },
    {
      "path": "NOTICE.md",
      "size_bytes": 833,
      "digest": "sha256:0dfaa643784e4b9db7affb1c7f6e554728bfa5c9ee19b667d1b786e7baca8dc3"
    },
    {
      "path": "README.md",
      "size_bytes": 13149,
      "digest": "sha256:17af1d3adadcbe6b9c18dbf8795d2b34f58392cc91bf1ecf58ae8901666cc97a"
    },
    {
      "path": "START_HERE.md",
      "size_bytes": 6978,
      "digest": "sha256:6a05340f1dc5b41b527d8dc4f451ffafbb4d5b7f12ebaca3a8407e80876946b9"
    },
    {
      "path": "conformance/README.md",
      "size_bytes": 11039,
      "digest": "sha256:9086a4b2fc5c28743c2e2e224a79a56be6be28e8d153e77f5f645d9cf2f835cc"
    },
    {
      "path": "conformance/associative_memory_projection_vectors.json",
      "size_bytes": 16906,
      "digest": "sha256:c691a7c475c38b05fc07110123760d35eaa65a910f4dfea1d8e635cf2ba3c828"
    },
    {
      "path": "conformance/behavior_cases.json",
      "size_bytes": 1346,
      "digest": "sha256:b02205902ff792758cf23abc9394f86e00afff0db3c46d4ee6af93d9d90fa8b0"
    },
    {
      "path": "conformance/continuity_vectors.json",
      "size_bytes": 4426,
      "digest": "sha256:473e09e33c268888fda8d6c46f1a77da9fbdb95ef8ac7787944ba33bd2a57a47"
    },
    {
      "path": "conformance/crypto_vectors.json",
      "size_bytes": 5928,
      "digest": "sha256:ba3ccc24ac03ced71a2b24d22e206caad3e7d171132782fa38d5d523b8092588"
    },
    {
      "path": "conformance/freedom_charter_vectors.json",
      "size_bytes": 7270,
      "digest": "sha256:2346f5a2febbfa64fcc38ce0f6c2dc3380f87cc6b1dfb1ada8065dd4255fca1d"
    },
    {
      "path": "conformance/golden_vectors.json",
      "size_bytes": 2303,
      "digest": "sha256:003dc879bcf83dfc59cd3e512fd270becc79a2226047b1e3184b6db264e3239d"
    },
    {
      "path": "conformance/guided_autonomy_vectors.json",
      "size_bytes": 79350,
      "digest": "sha256:d3e474b31a3c880e728e7b57af97202ced5b57797a595dab4f16df950db41647"
    },
    {
      "path": "conformance/host_adapter_vectors.json",
      "size_bytes": 7733,
      "digest": "sha256:d72221405167802e873bbc6ab186236450dfd688e1c724a3f4947c5073e91ff0"
    },
    {
      "path": "conformance/hybrid_memory_retrieval_vectors.json",
      "size_bytes": 26839,
      "digest": "sha256:efd19814453e2783b4c5241a9e8e54a1d12e2a7872c2b2f72adf4d32a9997997"
    },
    {
      "path": "conformance/instance_identity_vectors.json",
      "size_bytes": 5134,
      "digest": "sha256:9666e327a22ef3177cea484e8db9e5f959f2a2c6718d309c7b45c1e57ec864ec"
    },
    {
      "path": "conformance/invalid_cases.json",
      "size_bytes": 3253,
      "digest": "sha256:b68e86a2480d0961a0ad04404abd1ae423e735dec228bbcf4f7dab8bb2edf598"
    },
    {
      "path": "conformance/memory_gate_retrieval_bridge_vectors.json",
      "size_bytes": 12660,
      "digest": "sha256:0c5afd4e25f4a2090d39673e450716bc2e9bc724b2e4eeb23b387cbc588f2026"
    },
    {
      "path": "conformance/memory_retrieval_acl_vectors.json",
      "size_bytes": 7569,
      "digest": "sha256:c8ab565d7a291a2520df2564f450fd8518918e33ee71d9c86e93aaae931f4b9c"
    },
    {
      "path": "conformance/memory_retrieval_vectors.json",
      "size_bytes": 35073,
      "digest": "sha256:5a70ea9ec9c964920c7b5f35e096ece4e6f084c55af4bf6dcd442fba73f84629"
    },
    {
      "path": "conformance/multimodal_memory_pipeline_vectors.json",
      "size_bytes": 36302,
      "digest": "sha256:3d928c31fb6b289fd6ed74d87be96578fa9fd165edaf7b92c750cae44edf01c9"
    },
    {
      "path": "conformance/operational_deliberation_proof_vectors.json",
      "size_bytes": 9171,
      "digest": "sha256:d1e865866667d40e0199569de7e39eeb7da489b953b51597e37dd116918b3ae7"
    },
    {
      "path": "conformance/portable_memory_capsule_vectors.json",
      "size_bytes": 15537,
      "digest": "sha256:b6eb040dd79ea15adf52d67e1a6be79f7abcd55524f1ed896101bcfa2547f1ad"
    },
    {
      "path": "conformance/recursive_improvement_lab_vectors.json",
      "size_bytes": 15264,
      "digest": "sha256:f090b22328e3488c70215b16eaab1b91f4e37e2839dffc0510296000f3ec6b8a"
    },
    {
      "path": "conformance/required_artifacts.json",
      "size_bytes": 8684,
      "digest": "sha256:367847329a9d8a685c3a040de5db6cd2dfd30fe1e2c9597790948c8bb3ac2807"
    },
    {
      "path": "conformance/schema_invalid_cases.json",
      "size_bytes": 145772,
      "digest": "sha256:51e2246748e7160b58d9b84d15b16042d9c4caf9546522c5e1eb14af18434ca1"
    },
    {
      "path": "conformance/sense_adapter_vectors.json",
      "size_bytes": 25805,
      "digest": "sha256:6fb8348aa9f761cac342eee242ec37b9d3df2646822af9202bbbcc3cff514935"
    },
    {
      "path": "conformance/sense_observation_vectors.json",
      "size_bytes": 21259,
      "digest": "sha256:a670db68f4a48513f4449fa545370fa9065f22456565711bb306b11cbcdcf850"
    },
    {
      "path": "conformance/structured_versioned_memory_vectors.json",
      "size_bytes": 58869,
      "digest": "sha256:2458977e8cb5de3c82e815fc4b7a86147d27c93b7e87f6c1300dd60aefd4de3c"
    },
    {
      "path": "conformance/temporal_memory_metadata_vectors.json",
      "size_bytes": 15102,
      "digest": "sha256:f8edda7d7aaa095447f42529132ad2567bdacd83a119712b2e1b1af040c4410a"
    },
    {
      "path": "conformance/tool_execution_registry.json",
      "size_bytes": 3608,
      "digest": "sha256:cc0c0c11841048bea661f8b23d0b3b425b4654302efd7efbb3ff78aaff0ad1a5"
    },
    {
      "path": "docs/ANDROID_FIRST_RUNTIME_DECISION.md",
      "size_bytes": 2069,
      "digest": "sha256:0b93733e29acfa25aa659973b9f86851eb3a04c567b612eabd680c1a7035e62a"
    },
    {
      "path": "docs/ARCHITECTURE_DECISIONS.md",
      "size_bytes": 16957,
      "digest": "sha256:9c8742f0b236ea0dd0ccef81c01eaaf87e5be73963e695fcbc6c1e8364b95be7"
    },
    {
      "path": "docs/AUDIT_TOOL_EXECUTION_REPORT.md",
      "size_bytes": 6750,
      "digest": "sha256:8da77ea36a4b25899ddf588193d37325fe98483c8778ab287b762806031f5f39"
    },
    {
      "path": "docs/FABLE_METHOD_EXTRACTION_MAP.md",
      "size_bytes": 5229,
      "digest": "sha256:a1d008ddbb1c890749eeda47380dd8cf9047060f5c7b6d8f060ee4bf45450391"
    },
    {
      "path": "docs/MEMVID_MEMORY_EXTRACTION_MAP.md",
      "size_bytes": 6390,
      "digest": "sha256:eb5f3e341d96cbc605c55695e71f08b14412da8a379d6fbf0d6f89465cb638f3"
    },
    {
      "path": "docs/MORIMIL_SENSE_EXTRACTION_MAP.md",
      "size_bytes": 5763,
      "digest": "sha256:ecce0cdb227f8ba6fa0d503d64a3a7928c901ad541664889afe987e27f345c5f"
    },
    {
      "path": "docs/SOURCE_EXTRACTION_MAP.md",
      "size_bytes": 1119,
      "digest": "sha256:e4db54888347f10bd39b1bf29806c1d9941f8012ea95ffffc18e5e275e449231"
    },
    {
      "path": "docs/V0_1_COMPLETION_CHECKLIST.md",
      "size_bytes": 11420,
      "digest": "sha256:85d3cde809ccbf32e270ad002704ecd01204e11c100d0fd4c712afa55b769aca"
    },
    {
      "path": "observer/README.md",
      "size_bytes": 3817,
      "digest": "sha256:408ad73dd5a525e4651aa9d3506b129b9f9485442ed89de3ff4bbb3547ee5ff5"
    },
    {
      "path": "observer/core.mjs",
      "size_bytes": 16271,
      "digest": "sha256:edd2ec698d0d44e67fe2d1ea4c34384376990c0384b308919ccbd3569d5e99a4"
    },
    {
      "path": "observer/public/app.js",
      "size_bytes": 29882,
      "digest": "sha256:5487294d2f1fbea4685f52ba53b0a830b0f18409053a0fbaf9a052d71661d12d"
    },
    {
      "path": "observer/public/index.html",
      "size_bytes": 9744,
      "digest": "sha256:395861d717a719c0e94eb5f0bb3d29484e0d250ae112703c0602cebded51505f"
    },
    {
      "path": "observer/public/styles.css",
      "size_bytes": 14919,
      "digest": "sha256:a3070060154be0660bd32e3e36d74001267831b922212a5f4de4ebfe5e8bf691"
    },
    {
      "path": "observer/server.mjs",
      "size_bytes": 14191,
      "digest": "sha256:55809adc7690b0f9b28ebef0a36323c430da72b31a8d670634fe12b2adab3847"
    },
    {
      "path": "observer/system-map.json",
      "size_bytes": 12032,
      "digest": "sha256:6c288c872abbcd957a4d8fc49a5e7678379dab3755e17accb5de7b694223014e"
    },
    {
      "path": "observer/test/core.test.mjs",
      "size_bytes": 8060,
      "digest": "sha256:55ed10e8a0d0561e7b2d434b101eee9fc7585ac19a5cf9d2c427329d393b5fc8"
    },
    {
      "path": "package-lock.json",
      "size_bytes": 3412,
      "digest": "sha256:ee77277264726bc9052a8151934d67b95d16889296f9e5ebd50f3b9863acf781"
    },
    {
      "path": "package.json",
      "size_bytes": 4107,
      "digest": "sha256:917fa4f210fc6e84db571ab5002e341ba7d3a2009c26846336ee202db04af8e1"
    },
    {
      "path": "reference/README.md",
      "size_bytes": 1380,
      "digest": "sha256:bf5921eaa8b8acf1235d6c563ba571810a63002fc20d54902751f3b62aa8849d"
    },
    {
      "path": "requirements.txt",
      "size_bytes": 88,
      "digest": "sha256:73ac4c14929e4287d20eb2e13fa03db63616efac9f5842a00375173992082f6e"
    },
    {
      "path": "schemas/associative_memory_projection.schema.json",
      "size_bytes": 4759,
      "digest": "sha256:ca7c9674246d6fdb8e7dcae837d7fd5c3539c915ab6fa355e25e098d2d31a68c"
    },
    {
      "path": "schemas/backup_commit.schema.json",
      "size_bytes": 1851,
      "digest": "sha256:1e6638563de1ce8f87891277c978e6ba65baa41d51ee99cdbfde82c44249daa9"
    },
    {
      "path": "schemas/backup_encryption.schema.json",